[INFO] Scanning for projects...
[WARNING] 
[WARNING] Some problems were encountered while building the effective model for com.example:cards-service:jar:0.0.1-SNAPSHOT
[WARNING] 'build.plugins.plugin.version' for org.springframework.boot:spring-boot-maven-plugin is missing. @ line 95, column 21
[WARNING] 
[WARNING] It is highly recommended to fix these problems because they threaten the stability of your build.
[WARNING] 
[WARNING] For this reason, future Maven versions might no longer support building such malformed projects.
[WARNING] 
[INFO] 
[INFO] ---------------------< com.example:cards-service >----------------------
[INFO] Building cards-service 0.0.1-SNAPSHOT
[INFO]   from pom.xml
[INFO] --------------------------------[ jar ]---------------------------------
[INFO] 
[INFO] --- resources:3.3.1:resources (default-resources) @ cards-service ---
[WARNING] Using platform encoding (UTF-8 actually) to copy filtered resources, i.e. build is platform dependent!
[INFO] Copying 2 resources from src/main/resources to target/classes
[INFO] 
[INFO] --- compiler:3.11.0:compile (default-compile) @ cards-service ---
[INFO] Nothing to compile - all classes are up to date
[INFO] 
[INFO] --- resources:3.3.1:testResources (default-testResources) @ cards-service ---
[WARNING] Using platform encoding (UTF-8 actually) to copy filtered resources, i.e. build is platform dependent!
[INFO] Copying 4 resources from src/test/resources to target/test-classes
[INFO] 
[INFO] --- compiler:3.11.0:testCompile (default-testCompile) @ cards-service ---
[INFO] Nothing to compile - all classes are up to date
[INFO] 
[INFO] --- surefire:3.2.2:test (default-test) @ cards-service ---
[INFO] Using auto detected provider org.apache.maven.surefire.junitplatform.JUnitPlatformProvider
[INFO] 
[INFO] -------------------------------------------------------
[INFO]  T E S T S
[INFO] -------------------------------------------------------
[INFO] Running com.example.cardsservice.cucumber.CucumberIntegrationTest

  .   ____          _            __ _ _
 /\\ / ___'_ __ _ _(_)_ __  __ _ \ \ \ \
( ( )\___ | '_ | '_| | '_ \/ _` | \ \ \ \
 \\/  ___)| |_)| | | | | || (_| |  ) ) ) )
  '  |____| .__|_| |_|_| |_\__, | / / / /
 =========|_|==============|___/=/_/_/_/
 :: Spring Boot ::                (v3.1.5)

2025-12-03T14:42:20.640+05:30  INFO 7469 --- [           main] c.e.c.c.s.CucumberSpringConfiguration    : Starting CucumberSpringConfiguration using Java 17.0.17 with PID 7469 (started by Mudassar.Hakim in /Users/Mudassar.Hakim/common-debit-card/cards-service)
2025-12-03T14:42:20.641+05:30  INFO 7469 --- [           main] c.e.c.c.s.CucumberSpringConfiguration    : No active profile set, falling back to 1 default profile: "default"
2025-12-03T14:42:20.993+05:30  INFO 7469 --- [           main] .s.d.r.c.RepositoryConfigurationDelegate : Multiple Spring Data modules found, entering strict repository configuration mode
2025-12-03T14:42:20.994+05:30  INFO 7469 --- [           main] .s.d.r.c.RepositoryConfigurationDelegate : Bootstrapping Spring Data JPA repositories in DEFAULT mode.
2025-12-03T14:42:21.054+05:30  INFO 7469 --- [           main] .s.d.r.c.RepositoryConfigurationDelegate : Finished Spring Data repository scanning in 57 ms. Found 1 JPA repository interfaces.
2025-12-03T14:42:21.059+05:30  INFO 7469 --- [           main] .s.d.r.c.RepositoryConfigurationDelegate : Multiple Spring Data modules found, entering strict repository configuration mode
2025-12-03T14:42:21.059+05:30  INFO 7469 --- [           main] .s.d.r.c.RepositoryConfigurationDelegate : Bootstrapping Spring Data Redis repositories in DEFAULT mode.
2025-12-03T14:42:21.066+05:30  INFO 7469 --- [           main] .RepositoryConfigurationExtensionSupport : Spring Data Redis - Could not safely identify store assignment for repository candidate interface com.example.cardsservice.repository.CardRepository; If you want this repository to be a Redis repository, consider annotating your entities with one of these annotations: org.springframework.data.redis.core.RedisHash (preferred), or consider extending one of the following types with your repository: org.springframework.data.keyvalue.repository.KeyValueRepository
2025-12-03T14:42:21.066+05:30  INFO 7469 --- [           main] .s.d.r.c.RepositoryConfigurationDelegate : Finished Spring Data repository scanning in 4 ms. Found 0 Redis repository interfaces.
2025-12-03T14:42:21.166+05:30  INFO 7469 --- [           main] o.s.cloud.context.scope.GenericScope     : BeanFactory id=35d85d93-8885-3651-b620-4131668936b1
2025-12-03T14:42:21.366+05:30  INFO 7469 --- [           main] o.hibernate.jpa.internal.util.LogHelper  : HHH000204: Processing PersistenceUnitInfo [name: default]
2025-12-03T14:42:21.385+05:30  INFO 7469 --- [           main] org.hibernate.Version                    : HHH000412: Hibernate ORM core version 6.2.13.Final
2025-12-03T14:42:21.385+05:30  INFO 7469 --- [           main] org.hibernate.cfg.Environment            : HHH000406: Using bytecode reflection optimizer
2025-12-03T14:42:21.462+05:30  INFO 7469 --- [           main] o.s.o.j.p.SpringPersistenceUnitInfo      : No LoadTimeWeaver setup: ignoring JPA class transformer
2025-12-03T14:42:21.471+05:30  INFO 7469 --- [           main] com.zaxxer.hikari.HikariDataSource       : HikariPool-1 - Starting...
2025-12-03T14:42:21.532+05:30  INFO 7469 --- [           main] com.zaxxer.hikari.pool.HikariPool        : HikariPool-1 - Added connection conn0: url=jdbc:h2:mem:testdb user=SA
2025-12-03T14:42:21.533+05:30  INFO 7469 --- [           main] com.zaxxer.hikari.HikariDataSource       : HikariPool-1 - Start completed.
2025-12-03T14:42:21.540+05:30  WARN 7469 --- [           main] org.hibernate.orm.deprecation            : HHH90000025: H2Dialect does not need to be specified explicitly using 'hibernate.dialect' (remove the property setting and it will be selected by default)
2025-12-03T14:42:21.812+05:30  INFO 7469 --- [           main] o.h.e.t.j.p.i.JtaPlatformInitiator       : HHH000489: No JTA platform available (set 'hibernate.transaction.jta.platform' to enable JTA platform integration)
2025-12-03T14:42:21.826+05:30  INFO 7469 --- [           main] j.LocalContainerEntityManagerFactoryBean : Initialized JPA EntityManagerFactory for persistence unit 'default'
2025-12-03T14:42:21.945+05:30  WARN 7469 --- [           main] ocalVariableTableParameterNameDiscoverer : Using deprecated '-debug' fallback for parameter name resolution. Compile the affected code with '-parameters' instead or avoid its introspection: com.example.cardsservice.repository.CardRepository
2025-12-03T14:42:22.214+05:30  WARN 7469 --- [           main] JpaBaseConfiguration$JpaWebConfiguration : spring.jpa.open-in-view is enabled by default. Therefore, database queries may be performed during view rendering. Explicitly configure spring.jpa.open-in-view to disable this warning
2025-12-03T14:42:22.679+05:30  INFO 7469 --- [           main] o.s.b.t.m.w.SpringBootMockServletContext : Initializing Spring TestDispatcherServlet ''
2025-12-03T14:42:22.679+05:30  INFO 7469 --- [           main] o.s.t.web.servlet.TestDispatcherServlet  : Initializing Servlet ''
2025-12-03T14:42:22.682+05:30  INFO 7469 --- [           main] o.s.b.a.e.web.EndpointLinksResolver      : Exposing 1 endpoint(s) beneath base path '/actuator'
2025-12-03T14:42:22.690+05:30  INFO 7469 --- [           main] o.s.t.web.servlet.TestDispatcherServlet  : Completed initialization in 11 ms
2025-12-03T14:42:22.754+05:30  INFO 7469 --- [           main] o.a.k.clients.consumer.ConsumerConfig    : ConsumerConfig values: 
	allow.auto.create.topics = true
	auto.commit.interval.ms = 5000
	auto.include.jmx.reporter = true
	auto.offset.reset = earliest
	bootstrap.servers = [localhost:9092]
	check.crcs = true
	client.dns.lookup = use_all_dns_ips
	client.id = consumer-card-repo-group-1
	client.rack = 
	connections.max.idle.ms = 540000
	default.api.timeout.ms = 60000
	enable.auto.commit = false
	exclude.internal.topics = true
	fetch.max.bytes = 52428800
	fetch.max.wait.ms = 500
	fetch.min.bytes = 1
	group.id = card-repo-group
	group.instance.id = null
	heartbeat.interval.ms = 3000
	interceptor.classes = []
	internal.leave.group.on.close = true
	internal.throw.on.fetch.stable.offset.unsupported = false
	isolation.level = read_uncommitted
	key.deserializer = class org.apache.kafka.common.serialization.StringDeserializer
	max.partition.fetch.bytes = 1048576
	max.poll.interval.ms = 300000
	max.poll.records = 500
	metadata.max.age.ms = 300000
	metric.reporters = []
	metrics.num.samples = 2
	metrics.recording.level = INFO
	metrics.sample.window.ms = 30000
	partition.assignment.strategy = [class org.apache.kafka.clients.consumer.RangeAssignor, class org.apache.kafka.clients.consumer.CooperativeStickyAssignor]
	receive.buffer.bytes = 65536
	reconnect.backoff.max.ms = 1000
	reconnect.backoff.ms = 50
	request.timeout.ms = 30000
	retry.backoff.ms = 100
	sasl.client.callback.handler.class = null
	sasl.jaas.config = null
	sasl.kerberos.kinit.cmd = /usr/bin/kinit
	sasl.kerberos.min.time.before.relogin = 60000
	sasl.kerberos.service.name = null
	sasl.kerberos.ticket.renew.jitter = 0.05
	sasl.kerberos.ticket.renew.window.factor = 0.8
	sasl.login.callback.handler.class = null
	sasl.login.class = null
	sasl.login.connect.timeout.ms = null
	sasl.login.read.timeout.ms = null
	sasl.login.refresh.buffer.seconds = 300
	sasl.login.refresh.min.period.seconds = 60
	sasl.login.refresh.window.factor = 0.8
	sasl.login.refresh.window.jitter = 0.05
	sasl.login.retry.backoff.max.ms = 10000
	sasl.login.retry.backoff.ms = 100
	sasl.mechanism = GSSAPI
	sasl.oauthbearer.clock.skew.seconds = 30
	sasl.oauthbearer.expected.audience = null
	sasl.oauthbearer.expected.issuer = null
	sasl.oauthbearer.jwks.endpoint.refresh.ms = 3600000
	sasl.oauthbearer.jwks.endpoint.retry.backoff.max.ms = 10000
	sasl.oauthbearer.jwks.endpoint.retry.backoff.ms = 100
	sasl.oauthbearer.jwks.endpoint.url = null
	sasl.oauthbearer.scope.claim.name = scope
	sasl.oauthbearer.sub.claim.name = sub
	sasl.oauthbearer.token.endpoint.url = null
	security.protocol = PLAINTEXT
	security.providers = null
	send.buffer.bytes = 131072
	session.timeout.ms = 45000
	socket.connection.setup.timeout.max.ms = 30000
	socket.connection.setup.timeout.ms = 10000
	ssl.cipher.suites = null
	ssl.enabled.protocols = [TLSv1.2, TLSv1.3]
	ssl.endpoint.identification.algorithm = https
	ssl.engine.factory.class = null
	ssl.key.password = null
	ssl.keymanager.algorithm = SunX509
	ssl.keystore.certificate.chain = null
	ssl.keystore.key = null
	ssl.keystore.location = null
	ssl.keystore.password = null
	ssl.keystore.type = JKS
	ssl.protocol = TLSv1.3
	ssl.provider = null
	ssl.secure.random.implementation = null
	ssl.trustmanager.algorithm = PKIX
	ssl.truststore.certificates = null
	ssl.truststore.location = null
	ssl.truststore.password = null
	ssl.truststore.type = JKS
	value.deserializer = class org.apache.kafka.common.serialization.StringDeserializer

2025-12-03T14:42:22.799+05:30  INFO 7469 --- [           main] o.a.kafka.common.utils.AppInfoParser     : Kafka version: 3.4.1
2025-12-03T14:42:22.799+05:30  INFO 7469 --- [           main] o.a.kafka.common.utils.AppInfoParser     : Kafka commitId: 8a516edc2755df89
2025-12-03T14:42:22.799+05:30  INFO 7469 --- [           main] o.a.kafka.common.utils.AppInfoParser     : Kafka startTimeMs: 1764753142798
2025-12-03T14:42:22.804+05:30  INFO 7469 --- [           main] o.a.k.clients.consumer.KafkaConsumer     : [Consumer clientId=consumer-card-repo-group-1, groupId=card-repo-group] Subscribed to topic(s): card-events
2025-12-03T14:42:22.821+05:30  INFO 7469 --- [           main] c.e.c.c.s.CucumberSpringConfiguration    : Started CucumberSpringConfiguration in 2.288 seconds (process running for 2.902)
OpenJDK 64-Bit Server VM warning: Sharing is only supported for boot loader classes because bootstrap classpath has been appended
2025-12-03T14:42:23.339+05:30  INFO 7469 --- [ntainer#0-0-C-1] org.apache.kafka.clients.NetworkClient   : [Consumer clientId=consumer-card-repo-group-1, groupId=card-repo-group] Node -1 disconnected.
2025-12-03T14:42:23.348+05:30  INFO 7469 --- [ntainer#0-0-C-1] org.apache.kafka.clients.NetworkClient   : [Consumer clientId=consumer-card-repo-group-1, groupId=card-repo-group] Cancelled in-flight API_VERSIONS request with correlation id 1 due to node -1 being disconnected (elapsed time since creation: 432ms, elapsed time since send: 432ms, request timeout: 30000ms)
2025-12-03T14:42:23.348+05:30  WARN 7469 --- [ntainer#0-0-C-1] org.apache.kafka.clients.NetworkClient   : [Consumer clientId=consumer-card-repo-group-1, groupId=card-repo-group] Bootstrap broker localhost:9092 (id: -1 rack: null) disconnected
2025-12-03T14:42:23.528+05:30  INFO 7469 --- [ntainer#0-0-C-1] org.apache.kafka.clients.NetworkClient   : [Consumer clientId=consumer-card-repo-group-1, groupId=card-repo-group] Node -1 disconnected.
2025-12-03T14:42:23.529+05:30  INFO 7469 --- [ntainer#0-0-C-1] org.apache.kafka.clients.NetworkClient   : [Consumer clientId=consumer-card-repo-group-1, groupId=card-repo-group] Cancelled in-flight API_VERSIONS request with correlation id 2 due to node -1 being disconnected (elapsed time since creation: 87ms, elapsed time since send: 87ms, request timeout: 30000ms)
2025-12-03T14:42:23.529+05:30  WARN 7469 --- [ntainer#0-0-C-1] org.apache.kafka.clients.NetworkClient   : [Consumer clientId=consumer-card-repo-group-1, groupId=card-repo-group] Bootstrap broker localhost:9092 (id: -1 rack: null) disconnected
[ERROR] Tests run: 2, Failures: 1, Errors: 1, Skipped: 0, Time elapsed: 3.150 s <<< FAILURE! -- in com.example.cardsservice.cucumber.CucumberIntegrationTest
[ERROR] Internal Card Repository API.Retrieve cards for a customer -- Time elapsed: 3.084 s <<< FAILURE!
java.lang.AssertionError: Status expected:<200> but was:<404>
	at org.springframework.test.util.AssertionErrors.fail(AssertionErrors.java:59)
	at org.springframework.test.util.AssertionErrors.assertEquals(AssertionErrors.java:122)
	at org.springframework.test.web.servlet.result.StatusResultMatchers.lambda$matcher$9(StatusResultMatchers.java:637)
	at org.springframework.test.web.servlet.MockMvc$1.andExpect(MockMvc.java:214)
	at com.example.cardsservice.cucumber.steps.CardRepoSteps.i_should_receive_a_list_containing_at_least_one_card(CardRepoSteps.java:58)
	at ✽.I should receive a list containing at least one card(classpath:features/card_repo.feature:6)

[ERROR] Public Cards Service API.Retrieve cards for a customer -- Time elapsed: 0.020 s <<< ERROR!
org.mockito.exceptions.misusing.MissingMethodInvocationException: 

when() requires an argument which has to be 'a method call on a mock'.
For example:
    when(mock.getArticles()).thenReturn(articles);

Also, this error might show up because:
1. you stub either of: final/private/equals()/hashCode() methods.
   Those methods *cannot* be stubbed/verified.
   Mocking methods declared on non-public parent classes is not supported.
2. inside when() you don't call method on mock but on some other object.

	at com.example.cardsservice.cucumber.steps.CardsServiceSteps.the_integration_service_returns_cards_for_mobile_number(CardsServiceSteps.java:36)
	at ✽.the integration service returns cards for mobile number "1234567890"(classpath:features/cards_service.feature:4)

[INFO] 
[INFO] Results:
[INFO] 
[ERROR] Failures: 
[ERROR]   Status expected:<200> but was:<404>
[ERROR] Errors: 
[ERROR]   
when() requires an argument which has to be 'a method call on a mock'.
For example:
    when(mock.getArticles()).thenReturn(articles);

Also, this error might show up because:
1. you stub either of: final/private/equals()/hashCode() methods.
   Those methods *cannot* be stubbed/verified.
   Mocking methods declared on non-public parent classes is not supported.
2. inside when() you don't call method on mock but on some other object.

[INFO] 
[ERROR] Tests run: 2, Failures: 1, Errors: 1, Skipped: 0
[INFO] 
[INFO] ------------------------------------------------------------------------
[INFO] BUILD FAILURE
[INFO] ------------------------------------------------------------------------
[INFO] Total time:  4.932 s
[INFO] Finished at: 2025-12-03T14:42:23+05:30
[INFO] ------------------------------------------------------------------------
[ERROR] Failed to execute goal org.apache.maven.plugins:maven-surefire-plugin:3.2.2:test (default-test) on project cards-service: There are test failures.
[ERROR] 
[ERROR] Please refer to /Users/Mudassar.Hakim/common-debit-card/cards-service/target/surefire-reports for the individual test results.
[ERROR] Please refer to dump files (if any exist) [date].dump, [date]-jvmRun[N].dump and [date].dumpstream.
[ERROR] -> [Help 1]
[ERROR] 
[ERROR] To see the full stack trace of the errors, re-run Maven with the -e switch.
[ERROR] Re-run Maven using the -X switch to enable full debug logging.
[ERROR] 
[ERROR] For more information about the errors and possible solutions, please read the following articles:
[ERROR] [Help 1] http://cwiki.apache.org/confluence/display/MAVEN/MojoFailureException
